{
	"schemaVersion": 1,
	"submittedAt": "2026-10-04T13:18:15.686Z",
	"submitter": {
		"name": "Etienne Lescot"
	},
	"machine": {
		"platform": "linux",
		"chip": "AMD Ryzen 5 7520U with Radeon Graphics",
		"gpu": "Advanced Micro Devices, Inc. [AMD/ATI] Mendocino (rev c1)",
		"cpuCount": 8,
		"memoryGiB": 14.9,
		"osVersion": "24.04",
		"osBuild": ""
	},
	"conditions": {
		"onACPower": true,
		"maxForeignCpuPercent": 16.8,
		"loadSpreadPercentagePoints": 8.8,
		"driftRatio": 0.9975,
		"floorSpreadPercent": 0.22,
		"remoteDesktopActive": false
	},
	"scenario": {
		"step": "S4",
		"outputWidth": 1920,
		"outputHeight": 1080,
		"outputFps": 60,
		"outputCodec": "h264"
	},
	"source": {
		"kind": "public-bundle",
		"bundle": "commons-upload",
		"downloadSha256": "f8f1cd1fab93e739c6a071e5664619299f9f012d352f0055c1b52957d8004dc4",
		"normalisedSha256": "502588cae0a8507c03ee964006be140543206f3c774ef06dcbf9fdc5f369d9f1",
		"durationSec": 60.007,
		"frames": 3600
	},
	"measurements": [
		{
			"tool": "openscreen",
			"version": "2.0.0",
			"exportMs": 26973,
			"madMs": 41,
			"runs": 3,
			"localFloorMs": 18960,
			"softwareFloorMs": 34745,
			"floorSpreadPercent": 0.22,
			"cpuSeconds": 60,
			"peakRssMiB": 1019.8,
			"foreignCpuPercent": 5.2,
			"outputBytes": 98407047,
			"outputMeanVolumeDb": -37.8,
			"fidelity": 1,
			"missing": [],
			"contradicted": [],
			"verified": true,
			"automation": "cli"
		},
		{
			"tool": "cap",
			"version": "0.6.0",
			"exportMs": 51681,
			"madMs": 25,
			"runs": 3,
			"localFloorMs": 18905,
			"softwareFloorMs": 35157,
			"floorSpreadPercent": 0.15,
			"cpuSeconds": 158,
			"peakRssMiB": 764.2,
			"foreignCpuPercent": 14,
			"outputBytes": 188420825,
			"outputMeanVolumeDb": -49.8,
			"fidelity": 1,
			"missing": [],
			"contradicted": [],
			"verified": true,
			"automation": "cli"
		}
	],
	"notes": [
		"openscreen: MP4 export is fixed at 60 fps (MP4_EXPORT_FPS, src/cli/CliExportRunner.tsx) — which is why the pinned target is 60.",
		"cap: zoom segments written: 3",
		"cap: camera track: content/camera.mp4; cursor telemetry: content/cursor.json; audio: content/system-audio.m4a",
		"run linux-20261004 did not measure recordly 1.4.0: on this machine every export ends on its own \"Lightning (Beta) export failed\" panel — Reason: Cannot read properties of undefined (reading '_resourceType'); Renderer: webgpu; Encoder path: WebCodecs (avc1.640033/prefer-software/realtime); Breeze fallback: H.264 Annex B encoding is not supported at 1920x1080. 1.4.0 normalises exportPipelineModel to \"modern\" whatever a project asks, so the Legacy pipeline earlier Linux rows used is no longer reachable."
	]
}
