{
	"schemaVersion": 1,
	"submittedAt": "2026-08-28T11:25:33.264Z",
	"machine": {
		"platform": "darwin",
		"chip": "Apple M1",
		"gpu": "Apple M1",
		"cpuCount": 8,
		"memoryGiB": 8,
		"osVersion": "26.5",
		"osBuild": "25F71"
	},
	"conditions": {
		"onACPower": true,
		"maxForeignCpuPercent": 110.3,
		"loadSpreadPercentagePoints": 35.2,
		"driftRatio": 0.9996,
		"remoteDesktopActive": false
	},
	"scenario": {
		"step": "S4",
		"outputWidth": 1920,
		"outputHeight": 1080,
		"outputFps": 60,
		"outputCodec": "h264"
	},
	"source": {
		"kind": "public-bundle",
		"bundle": "commons-upload",
		"downloadSha256": "f8f1cd1fab93e739c6a071e5664619299f9f012d352f0055c1b52957d8004dc4",
		"normalisedSha256": "c407c71ad0de9c89533abe2d66918657f76f4e9474d86241efc8e03e5d779c66",
		"durationSec": 60,
		"frames": 3600
	},
	"measurements": [
		{
			"tool": "openscreen",
			"version": "1.10.0",
			"exportMs": 36797,
			"madMs": 5,
			"runs": 3,
			"localFloorMs": 18186,
			"cpuSeconds": 8.54,
			"peakRssMiB": 719.2,
			"foreignCpuPercent": 80.8,
			"outputBytes": 60015257,
			"outputMeanVolumeDb": null,
			"fidelity": 1,
			"missing": [],
			"contradicted": [],
			"verified": true,
			"automation": "cli"
		},
		{
			"tool": "cap",
			"version": "0.5.9",
			"exportMs": 22008,
			"madMs": 27,
			"runs": 3,
			"localFloorMs": 18181,
			"cpuSeconds": 24.39,
			"peakRssMiB": 1485.3,
			"foreignCpuPercent": 57.9,
			"outputBytes": 94232079,
			"outputMeanVolumeDb": null,
			"fidelity": 1,
			"missing": [],
			"contradicted": [],
			"verified": true,
			"automation": "cli"
		},
		{
			"tool": "recordly",
			"version": "1.3.3",
			"exportMs": 47742,
			"madMs": 14,
			"runs": 3,
			"localFloorMs": 18180,
			"cpuSeconds": 90.61,
			"peakRssMiB": 1231.8,
			"foreignCpuPercent": 93.1,
			"outputBytes": 87844054,
			"outputMeanVolumeDb": null,
			"fidelity": 1,
			"missing": [],
			"contradicted": [],
			"verified": true,
			"automation": "cdp"
		}
	],
	"notes": [
		"openscreen: MP4 export is fixed at 60 fps (MP4_EXPORT_FPS, src/cli/CliExportRunner.tsx) \u2014 which is why the pinned target is 60.",
		"cap: zoom segments written: 3",
		"cap: camera track: content/camera.mp4; cursor telemetry: content/cursor.json; audio: content/system-audio.m4a",
		"recordly: CUDA export path: available=false, requested=false",
		"recordly: zoom 1.6x is not a preset; applied 1.5x (depth 2)",
		"recordly: Export is triggered through the editor's own action, so the app picks its pipeline, backend and encoder as it would for a user; the backend it actually used is recorded from its progress events."
	]
}
