{
  "schemaVersion": 1,
  "submittedAt": "2026-09-08T13:28:47.696Z",
  "submitter": {
    "name": "Etienne Lescot"
  },
  "machine": {
    "platform": "darwin",
    "chip": "Apple M1",
    "gpu": "Apple M1",
    "cpuCount": 8,
    "memoryGiB": 8,
    "osVersion": "26.5",
    "osBuild": "25F71"
  },
  "conditions": {
    "onACPower": true,
    "maxForeignCpuPercent": 66,
    "loadSpreadPercentagePoints": 11.3,
    "driftRatio": 0.998,
    "floorSpreadPercent": 0.49,
    "remoteDesktopActive": false
  },
  "scenario": {
    "step": "S4",
    "outputWidth": 1920,
    "outputHeight": 1080,
    "outputFps": 60,
    "outputCodec": "h264"
  },
  "source": {
    "kind": "public-bundle",
    "bundle": "commons-upload",
    "downloadSha256": "f8f1cd1fab93e739c6a071e5664619299f9f012d352f0055c1b52957d8004dc4",
    "normalisedSha256": "c407c71ad0de9c89533abe2d66918657f76f4e9474d86241efc8e03e5d779c66",
    "durationSec": 60,
    "frames": 3600
  },
  "measurements": [
    {
      "tool": "openscreen-cli",
      "version": "1.11.0-rc.1",
      "exportMs": 19030,
      "madMs": 34,
      "runs": 3,
      "localFloorMs": 18241,
      "softwareFloorMs": null,
      "floorSpreadPercent": 0.49,
      "cpuSeconds": 27.56,
      "peakRssMiB": 783.9,
      "foreignCpuPercent": 62.1,
      "outputBytes": 60032092,
      "outputMeanVolumeDb": -49.8,
      "fidelity": 1,
      "missing": [],
      "contradicted": [],
      "verified": true,
      "automation": "cli"
    },
    {
      "tool": "cap",
      "version": "0.5.9",
      "exportMs": 22881,
      "madMs": 12,
      "runs": 3,
      "localFloorMs": 18239,
      "softwareFloorMs": null,
      "floorSpreadPercent": 0.21,
      "cpuSeconds": 26.1,
      "peakRssMiB": 1587.7,
      "foreignCpuPercent": 50.8,
      "outputBytes": 94287791,
      "outputMeanVolumeDb": -49.8,
      "fidelity": 1,
      "missing": [],
      "contradicted": [],
      "verified": true,
      "automation": "cli"
    }
  ],
  "notes": [
    "openscreen-cli: MP4 export is fixed at 60 fps (MP4_EXPORT_FPS, src/cli/CliExportRunner.tsx) — which is why the pinned target is 60.",
    "cap: zoom segments written: 3",
    "cap: camera track: content/camera.mp4; cursor telemetry: content/cursor.json; audio: content/system-audio.m4a"
  ]
}
