{
  "schemaVersion": 1,
  "submittedAt": "2026-09-08T21:55:42.603Z",
  "submitter": {
    "name": "Etienne Lescot"
  },
  "machine": {
    "platform": "win32",
    "chip": "AMD Ryzen 5 7520U with Radeon Graphics",
    "gpu": "AMD Radeon(TM) Graphics",
    "cpuCount": 8,
    "memoryGiB": 15.3,
    "osVersion": "10.0.26200",
    "osBuild": "26200"
  },
  "conditions": {
    "onACPower": true,
    "maxForeignCpuPercent": 91.5,
    "loadSpreadPercentagePoints": 8,
    "driftRatio": 1.1394,
    "floorSpreadPercent": 20.88,
    "remoteDesktopActive": false
  },
  "scenario": {
    "step": "S4",
    "outputWidth": 1920,
    "outputHeight": 1080,
    "outputFps": 60,
    "outputCodec": "h264"
  },
  "source": {
    "kind": "public-bundle",
    "bundle": "commons-upload",
    "downloadSha256": "f8f1cd1fab93e739c6a071e5664619299f9f012d352f0055c1b52957d8004dc4",
    "normalisedSha256": "ef5cc06cc6299da594c9b0f95a64bfef083b17152a5466264d7364c205d4fb4a",
    "durationSec": 60,
    "frames": 3600
  },
  "measurements": [
    {
      "tool": "openscreen-cli",
      "version": "1.10.0",
      "exportMs": 38555,
      "madMs": 88,
      "runs": 3,
      "localFloorMs": 19130,
      "softwareFloorMs": 40532,
      "floorSpreadPercent": 1.88,
      "cpuSeconds": 10.64,
      "peakRssMiB": 946.5,
      "foreignCpuPercent": 64,
      "outputBytes": 56884485,
      "outputMeanVolumeDb": -49.8,
      "fidelity": 1,
      "missing": [],
      "contradicted": [],
      "verified": true,
      "automation": "cli"
    },
    {
      "tool": "cap",
      "version": "0.5.9",
      "exportMs": 181176,
      "madMs": 3216,
      "runs": 3,
      "localFloorMs": 19387,
      "softwareFloorMs": 44041,
      "floorSpreadPercent": 20.88,
      "cpuSeconds": 104.44,
      "peakRssMiB": 2358.9,
      "foreignCpuPercent": 72,
      "outputBytes": 151105336,
      "outputMeanVolumeDb": -49.8,
      "fidelity": 1,
      "missing": [],
      "contradicted": [],
      "verified": true,
      "automation": "cli"
    }
  ],
  "notes": [
    "openscreen-cli: MP4 export is fixed at 60 fps (MP4_EXPORT_FPS, src/cli/CliExportRunner.tsx) — which is why the pinned target is 60.",
    "cap: zoom segments written: 3",
    "cap: camera track: content/camera.mp4; cursor telemetry: content/cursor.json; audio: content/system-audio.m4a"
  ]
}
