{
	"schemaVersion": 1,
	"submittedAt": "2026-10-04T06:54:56.098Z",
	"submitter": {
		"name": "Etienne Lescot"
	},
	"machine": {
		"platform": "darwin",
		"chip": "Apple M1",
		"gpu": "Apple M1",
		"cpuCount": 8,
		"memoryGiB": 8,
		"osVersion": "26.5",
		"osBuild": "25F71"
	},
	"conditions": {
		"onACPower": true,
		"maxForeignCpuPercent": 63.1,
		"loadSpreadPercentagePoints": 0,
		"driftRatio": 0.9999,
		"floorSpreadPercent": 0.19,
		"remoteDesktopActive": false
	},
	"scenario": {
		"step": "S4",
		"outputWidth": 1920,
		"outputHeight": 1080,
		"outputFps": 60,
		"outputCodec": "h264"
	},
	"source": {
		"kind": "public-bundle",
		"bundle": "commons-upload",
		"downloadSha256": "f8f1cd1fab93e739c6a071e5664619299f9f012d352f0055c1b52957d8004dc4",
		"normalisedSha256": "c407c71ad0de9c89533abe2d66918657f76f4e9474d86241efc8e03e5d779c66",
		"durationSec": 60,
		"frames": 3600
	},
	"measurements": [
		{
			"tool": "recordly",
			"version": "1.4.0",
			"exportMs": 49303,
			"madMs": 23,
			"runs": 3,
			"localFloorMs": 18331,
			"softwareFloorMs": null,
			"floorSpreadPercent": 0.19,
			"cpuSeconds": 65.24,
			"peakRssMiB": 1189.6,
			"foreignCpuPercent": 62.9,
			"outputBytes": 51364737,
			"outputMeanVolumeDb": -46.8,
			"fidelity": 1,
			"missing": [],
			"contradicted": [],
			"verified": true,
			"automation": "cdp"
		}
	],
	"notes": [
		"recordly: CUDA export path: available=false, requested=false",
		"recordly: zoom 1.6x is not a preset; applied 1.5x (depth 2)",
		"recordly: Export is triggered through the editor's own action, so the app picks its pipeline, backend and encoder as it would for a user; the backend it actually used is recorded from its progress events.",
		"ffmpeg-baseline: encoder: h264_videotoolbox (hardware)",
		"ffmpeg-baseline: No compositing: this row is the encode-only reference, not a product.",
		"recordly: taken from run 20261003T184226Z, whose openscreen and screen-studio rows are apple-m1-2026-10-03.json; each cost uses its own paired floor. The scene is not exactly the pinned one: Recordly 1.4.0 migrates the written project to its version 2 and saves back cursor size 2.5, cursor smoothing 0.67, cursor motion blur 0.6, webcam size 10 and webcam mirror on, where 1.5, 0.7, 0.5 and 0.25 were written (mirror unset). Wallpaper, shadow, zoom motion blur, padding and click effect are kept, and corner radius is converted (40 px -> 3.70 % of the short side). Published as is: the replaced values are judged not to move the cost significantly."
	]
}
