{
  "schemaVersion": 1,
  "submittedAt": "2026-09-08T13:42:19.962Z",
  "submitter": {
    "name": "Etienne Lescot"
  },
  "machine": {
    "platform": "linux",
    "chip": "AMD Ryzen 5 7520U with Radeon Graphics",
    "gpu": "Advanced Micro Devices, Inc. [AMD/ATI] Mendocino (rev c1)",
    "cpuCount": 8,
    "memoryGiB": 14.9,
    "osVersion": "24.04",
    "osBuild": ""
  },
  "conditions": {
    "onACPower": true,
    "maxForeignCpuPercent": 50,
    "loadSpreadPercentagePoints": 0.4,
    "driftRatio": 0.9998,
    "floorSpreadPercent": 3.98,
    "remoteDesktopActive": false
  },
  "scenario": {
    "step": "S4",
    "outputWidth": 1920,
    "outputHeight": 1080,
    "outputFps": 60,
    "outputCodec": "h264"
  },
  "source": {
    "kind": "public-bundle",
    "bundle": "commons-upload",
    "downloadSha256": "f8f1cd1fab93e739c6a071e5664619299f9f012d352f0055c1b52957d8004dc4",
    "normalisedSha256": "502588cae0a8507c03ee964006be140543206f3c774ef06dcbf9fdc5f369d9f1",
    "durationSec": 60.007,
    "frames": 3600
  },
  "measurements": [
    {
      "tool": "openscreen-cli",
      "version": "1.11.0-rc.1",
      "exportMs": 27271,
      "madMs": 22,
      "runs": 3,
      "localFloorMs": 24273,
      "softwareFloorMs": 37504,
      "floorSpreadPercent": 2.44,
      "cpuSeconds": 69,
      "peakRssMiB": 967.7,
      "foreignCpuPercent": 46.8,
      "outputBytes": 53038691,
      "outputMeanVolumeDb": -49.8,
      "fidelity": 1,
      "missing": [],
      "contradicted": [],
      "verified": true,
      "automation": "cli"
    },
    {
      "tool": "cap",
      "version": "0.5.9",
      "exportMs": 57025,
      "madMs": 2,
      "runs": 3,
      "localFloorMs": 23603,
      "softwareFloorMs": 37611,
      "floorSpreadPercent": 3.98,
      "cpuSeconds": 166,
      "peakRssMiB": 1232.4,
      "foreignCpuPercent": 47.2,
      "outputBytes": 188479190,
      "outputMeanVolumeDb": -49.8,
      "fidelity": 1,
      "missing": [],
      "contradicted": [],
      "verified": true,
      "automation": "cli"
    }
  ],
  "notes": [
    "openscreen-cli: MP4 export is fixed at 60 fps (MP4_EXPORT_FPS, src/cli/CliExportRunner.tsx) — which is why the pinned target is 60.",
    "cap: zoom segments written: 3",
    "cap: camera track: content/camera.mp4; cursor telemetry: content/cursor.json; audio: content/system-audio.m4a"
  ]
}
