{
  "schemaVersion": 1,
  "submittedAt": "2026-10-03T23:35:10.890Z",
  "submitter": {
    "name": "Etienne Lescot"
  },
  "machine": {
    "platform": "win32",
    "chip": "AMD Ryzen 5 7520U with Radeon Graphics",
    "gpu": "AMD Radeon(TM) Graphics",
    "cpuCount": 8,
    "memoryGiB": 15.3,
    "osVersion": "10.0.26200",
    "osBuild": "26200"
  },
  "conditions": {
    "onACPower": true,
    "maxForeignCpuPercent": 95.5,
    "loadSpreadPercentagePoints": 12.5,
    "driftRatio": 1.1166,
    "floorSpreadPercent": 8.51,
    "remoteDesktopActive": false
  },
  "scenario": {
    "step": "S4",
    "outputWidth": 1920,
    "outputHeight": 1080,
    "outputFps": 60,
    "outputCodec": "h264"
  },
  "source": {
    "kind": "public-bundle",
    "bundle": "commons-upload",
    "downloadSha256": "f8f1cd1fab93e739c6a071e5664619299f9f012d352f0055c1b52957d8004dc4",
    "normalisedSha256": "ef5cc06cc6299da594c9b0f95a64bfef083b17152a5466264d7364c205d4fb4a",
    "durationSec": 60,
    "frames": 3600
  },
  "measurements": [
    {
      "tool": "openscreen",
      "version": "2.0.0",
      "exportMs": 35436,
      "madMs": 2347,
      "runs": 3,
      "localFloorMs": 18369,
      "softwareFloorMs": 38958,
      "floorSpreadPercent": 8.51,
      "cpuSeconds": 9.91,
      "peakRssMiB": 919.2,
      "foreignCpuPercent": 37.5,
      "outputBytes": 131526575,
      "outputMeanVolumeDb": -37.8,
      "fidelity": 1,
      "missing": [],
      "contradicted": [],
      "verified": true,
      "automation": "cli"
    },
    {
      "tool": "cap",
      "version": "0.6.0",
      "exportMs": 130265,
      "madMs": 80,
      "runs": 3,
      "localFloorMs": 18625,
      "softwareFloorMs": 39776,
      "floorSpreadPercent": 2.66,
      "cpuSeconds": 48.05,
      "peakRssMiB": 1377.6,
      "foreignCpuPercent": 50,
      "outputBytes": 150743287,
      "outputMeanVolumeDb": -49.8,
      "fidelity": 1,
      "missing": [],
      "contradicted": [],
      "verified": true,
      "automation": "cli"
    },
    {
      "tool": "recordly",
      "version": "1.4.0",
      "exportMs": 216654,
      "madMs": 7295,
      "runs": 3,
      "localFloorMs": 31430,
      "softwareFloorMs": 40336,
      "floorSpreadPercent": 4.14,
      "cpuSeconds": 613.65,
      "peakRssMiB": 2324,
      "foreignCpuPercent": 48,
      "outputBytes": 79308927,
      "outputMeanVolumeDb": -46.8,
      "fidelity": 1,
      "missing": [],
      "contradicted": [],
      "verified": true,
      "automation": "cdp"
    }
  ],
  "notes": [
    "openscreen: MP4 export is fixed at 60 fps (MP4_EXPORT_FPS, src/cli/CliExportRunner.tsx) — which is why the pinned target is 60.",
    "cap: zoom segments written: 3",
    "cap: camera track: content/camera.mp4; cursor telemetry: content/cursor.json; audio: content/system-audio.m4a",
    "recordly: CUDA export path: available=false, requested=false",
    "recordly: zoom 1.6x is not a preset; applied 1.5x (depth 2)",
    "recordly: Export is triggered through the editor's own action, so the app picks its pipeline, backend and encoder as it would for a user; the backend it actually used is recorded from its progress events."
  ]
}
