{
  "schemaVersion": 1,
  "submittedAt": "2026-09-09T10:58:58.355Z",
  "submitter": {
    "name": "Etienne Lescot"
  },
  "machine": {
    "platform": "win32",
    "chip": "AMD Ryzen 7 5800X 8-Core Processor",
    "gpu": "NVIDIA GeForce RTX 4070 Ti",
    "cpuCount": 16,
    "memoryGiB": 31.9,
    "osVersion": "10.0.26200",
    "osBuild": "26200"
  },
  "conditions": {
    "onACPower": true,
    "maxForeignCpuPercent": 523,
    "loadSpreadPercentagePoints": 54,
    "driftRatio": 0.9801,
    "floorSpreadPercent": 2.2,
    "remoteDesktopActive": false
  },
  "scenario": {
    "step": "S4",
    "outputWidth": 1920,
    "outputHeight": 1080,
    "outputFps": 60,
    "outputCodec": "h264"
  },
  "source": {
    "kind": "public-bundle",
    "bundle": "commons-upload",
    "downloadSha256": "f8f1cd1fab93e739c6a071e5664619299f9f012d352f0055c1b52957d8004dc4",
    "normalisedSha256": "9162881a929643de62a4a97dee57571d514878d727585da60709bf4dfefd0d53",
    "durationSec": 60.007,
    "frames": 3600
  },
  "measurements": [
    {
      "tool": "openscreen",
      "version": "1.11.0-rc.1",
      "exportMs": 9752,
      "madMs": 297,
      "runs": 3,
      "localFloorMs": 7725,
      "softwareFloorMs": 16139,
      "floorSpreadPercent": 2.2,
      "cpuSeconds": 4.8,
      "peakRssMiB": 772.5,
      "foreignCpuPercent": 272,
      "outputBytes": 36647657,
      "outputMeanVolumeDb": -49.8,
      "fidelity": 1,
      "missing": [],
      "contradicted": [],
      "verified": true,
      "automation": "cli"
    },
    {
      "tool": "focusee",
      "version": "2.3.5",
      "exportMs": 8667,
      "madMs": 17,
      "runs": 3,
      "localFloorMs": 7568,
      "softwareFloorMs": 16909,
      "floorSpreadPercent": 0.29,
      "cpuSeconds": 46.84,
      "peakRssMiB": 2194.6,
      "foreignCpuPercent": 326,
      "outputBytes": 89583844,
      "outputMeanVolumeDb": -46.8,
      "fidelity": 1,
      "missing": [],
      "contradicted": [],
      "verified": true,
      "automation": "uia"
    }
  ],
  "notes": [
    "openscreen: MP4 export is fixed at 60 fps (MP4_EXPORT_FPS, src/cli/CliExportRunner.tsx) — which is why the pinned target is 60.",
    "focusee: timeline: / 01:00.00, zooms 1.6x 2.2x 1.8x",
    "focusee: telemetry: 3600 moves, 16 clicks",
    "focusee: padding=5/25, roundness=20/20 (FocuSee's own slider units — the scenario's 40px has no conversion into that range and is clamped), shadow=0.2",
    "focusee: the app took every channel the project declares",
    "focusee: caveat — its export carries 30.0s of sound in a 60.05s file. 2.3.5 halves the 48kHz mono sidecar on the 44.1kHz stereo export at matching loudness, which the loudness-only check could not see. This row predates the stereo staging and the audio-duration check."
  ]
}
