{
  "schemaVersion": 1,
  "submittedAt": "2026-09-16T08:23:48.132Z",
  "submitter": {
    "name": "Etienne Lescot"
  },
  "machine": {
    "platform": "darwin",
    "chip": "Apple M1",
    "gpu": "Apple M1",
    "cpuCount": 8,
    "memoryGiB": 8,
    "osVersion": "26.5",
    "osBuild": "25F71"
  },
  "conditions": {
    "onACPower": true,
    "maxForeignCpuPercent": 34.7,
    "loadSpreadPercentagePoints": 0,
    "driftRatio": 0.9999,
    "floorSpreadPercent": 0.04,
    "remoteDesktopActive": false
  },
  "scenario": {
    "step": "S4",
    "outputWidth": 1920,
    "outputHeight": 1080,
    "outputFps": 60,
    "outputCodec": "h264"
  },
  "source": {
    "kind": "public-bundle",
    "bundle": "commons-upload",
    "downloadSha256": "f8f1cd1fab93e739c6a071e5664619299f9f012d352f0055c1b52957d8004dc4",
    "normalisedSha256": "c407c71ad0de9c89533abe2d66918657f76f4e9474d86241efc8e03e5d779c66",
    "durationSec": 60,
    "frames": 3600
  },
  "measurements": [
    {
      "tool": "cap",
      "version": "0.6.0",
      "exportMs": 21602,
      "madMs": 28,
      "runs": 3,
      "localFloorMs": 18215,
      "softwareFloorMs": 21985,
      "floorSpreadPercent": 0.04,
      "cpuSeconds": 15.29,
      "peakRssMiB": 1022.6,
      "foreignCpuPercent": 34.6,
      "outputBytes": 91963851,
      "outputMeanVolumeDb": -49.8,
      "fidelity": 1,
      "missing": [],
      "contradicted": [],
      "verified": true,
      "automation": "cli"
    }
  ],
  "notes": [
    "cap: zoom segments written: 3",
    "cap: camera track: content/camera.mp4; cursor telemetry: content/cursor.json; audio: content/system-audio.m4a"
  ]
}
