{
  "schemaVersion": 1,
  "submittedAt": "2026-09-09T07:19:22.350Z",
  "submitter": {
    "name": "Etienne Lescot"
  },
  "machine": {
    "platform": "darwin",
    "chip": "Apple M1",
    "gpu": "Apple M1",
    "cpuCount": 8,
    "memoryGiB": 8,
    "osVersion": "26.5",
    "osBuild": "25F71"
  },
  "conditions": {
    "onACPower": true,
    "maxForeignCpuPercent": 79.9,
    "loadSpreadPercentagePoints": 27.3,
    "driftRatio": 0.9953,
    "floorSpreadPercent": 0.22,
    "remoteDesktopActive": false
  },
  "scenario": {
    "step": "S4",
    "outputWidth": 1920,
    "outputHeight": 1080,
    "outputFps": 60,
    "outputCodec": "h264"
  },
  "source": {
    "kind": "public-bundle",
    "bundle": "commons-upload",
    "downloadSha256": "f8f1cd1fab93e739c6a071e5664619299f9f012d352f0055c1b52957d8004dc4",
    "normalisedSha256": "c407c71ad0de9c89533abe2d66918657f76f4e9474d86241efc8e03e5d779c66",
    "durationSec": 60,
    "frames": 3600
  },
  "measurements": [
    {
      "tool": "screen-studio",
      "version": "3.7.5-4595",
      "exportMs": 85735,
      "madMs": 2,
      "runs": 3,
      "localFloorMs": 18317,
      "softwareFloorMs": 22471,
      "floorSpreadPercent": 0.22,
      "cpuSeconds": 219.99,
      "peakRssMiB": 1449.6,
      "foreignCpuPercent": 76.2,
      "outputBytes": 66894355,
      "outputMeanVolumeDb": -46.8,
      "fidelity": 1,
      "missing": [],
      "contradicted": [],
      "verified": true,
      "automation": "cdp+menu"
    },
    {
      "tool": "openscreen-cli",
      "version": "1.11.0-rc.1",
      "exportMs": 18902,
      "madMs": 30,
      "runs": 3,
      "localFloorMs": 18233,
      "softwareFloorMs": 22850,
      "floorSpreadPercent": 0.2,
      "cpuSeconds": 27.81,
      "peakRssMiB": 784.8,
      "foreignCpuPercent": 48.9,
      "outputBytes": 60032092,
      "outputMeanVolumeDb": -49.8,
      "fidelity": 1,
      "missing": [],
      "contradicted": [],
      "verified": true,
      "automation": "cli"
    }
  ],
  "notes": [
    "screen-studio: app read back: padding 3.8, radius 40, shadow 0.2, motion blur 0.5, cursor 1.5× (2006 moves, 16 clicks), camera 0.25 bottom-right, 3 zoom ranges, audio true",
    "screen-studio: cursor size is written as 150% → 1.5; the app's Cursor panel displays twice that, and its own default for an imported project is 1.5",
    "screen-studio: cursor smoothing is a spring here, not a scalar: 0.7 enables it and the app's own spring constants are left alone",
    "screen-studio: panels — screen: Background · Wallpaper · Gradient · Color · Image · Wallpaper · macOS · Spring · Sunset · Radiant · Energy · Iridescent · Midnight · Glassmorphism · Raycast · Pick random wallpaper · Background blur · Padding · 3.8% · Reset · Rounded corners · 40 · Reset · Ins",
    "screen-studio: panels — cursor: Cursor size · 3.0× · Reset · Cursor style · Always use pointer cursor · Don't change cursor, even if selecting text, etc. · Hide cursor if not moving · Loop cursor position · Near the end of the video, cursor will move back to its initial position · Hide curso",
    "screen-studio: panels — camera: · Dynamic camera layout · Camera position · Camera size · 25% · Reset · Roundness · 25% · Reset · Shape · Square · Horizontal · Vertical · Original · Mirror horizontally · Hide camera · Camera size during zoom ·",
    "openscreen-cli: MP4 export is fixed at 60 fps (MP4_EXPORT_FPS, src/cli/CliExportRunner.tsx) — which is why the pinned target is 60."
  ]
}
