{
  "schemaVersion": 1,
  "submittedAt": "2026-10-04T12:25:21.577Z",
  "submitter": {
    "name": "Etienne Lescot"
  },
  "machine": {
    "platform": "darwin",
    "chip": "Apple M1",
    "gpu": "Apple M1",
    "cpuCount": 8,
    "memoryGiB": 16,
    "osVersion": "27.0",
    "osBuild": "26A428"
  },
  "conditions": {
    "onACPower": true,
    "maxForeignCpuPercent": 247.8,
    "loadSpreadPercentagePoints": 84,
    "driftRatio": 0.9957,
    "floorSpreadPercent": 1.18,
    "remoteDesktopActive": false
  },
  "scenario": {
    "step": "S4",
    "outputWidth": 1920,
    "outputHeight": 1080,
    "outputFps": 60,
    "outputCodec": "h264"
  },
  "source": {
    "kind": "public-bundle",
    "bundle": "commons-upload",
    "downloadSha256": "f8f1cd1fab93e739c6a071e5664619299f9f012d352f0055c1b52957d8004dc4",
    "normalisedSha256": "04c5627dc26f3c0a06afdb31caf7160d33cfdf616ef4b9ac15909bb92b1c52a9",
    "durationSec": 60,
    "frames": 3600
  },
  "measurements": [
    {
      "tool": "openscreen",
      "version": "2.0.0",
      "exportMs": 20190,
      "madMs": 36,
      "runs": 3,
      "localFloorMs": 18795,
      "softwareFloorMs": 25154,
      "floorSpreadPercent": 1.18,
      "cpuSeconds": 30.39,
      "peakRssMiB": 858.4,
      "foreignCpuPercent": 161.8,
      "outputBytes": 135766084,
      "outputMeanVolumeDb": -37.8,
      "fidelity": 1,
      "missing": [],
      "contradicted": [],
      "verified": true,
      "automation": "cli"
    },
    {
      "tool": "screen-studio",
      "version": "4.0.1-4897",
      "exportMs": 36194,
      "madMs": 68,
      "runs": 3,
      "localFloorMs": 18684,
      "softwareFloorMs": 24854,
      "floorSpreadPercent": 0.43,
      "cpuSeconds": 56.16,
      "peakRssMiB": 1989.9,
      "foreignCpuPercent": 77.8,
      "outputBytes": 102976839,
      "outputMeanVolumeDb": -46.8,
      "fidelity": 1,
      "missing": [],
      "contradicted": [],
      "verified": true,
      "automation": "cdp+menu"
    }
  ],
  "notes": [
    "openscreen: MP4 export is fixed at 60 fps (MP4_EXPORT_FPS, src/cli/CliExportRunner.tsx) — which is why the pinned target is 60.",
    "screen-studio: app read back: padding 5.72, radius 40, shadow 0.2, motion blur 0.5, cursor 1.5× (2006 moves, 16 clicks), camera 0.25 bottom-right, 3 zoom ranges, audio true",
    "screen-studio: cursor size is written as 150% → 1.5; the app's Cursor panel displays twice that, and its own default for an imported project is 1.5",
    "screen-studio: cursor smoothing is a spring here, not a scalar: 0.7 enables it and the app's own spring constants are left alone",
    "screen-studio: panels — screen: ",
    "screen-studio: panels — cursor: ",
    "screen-studio: panels — camera: "
  ]
}
