{
  "schemaVersion": 1,
  "submittedAt": "2026-09-10T09:36:18.264Z",
  "submitter": {
    "name": "Etienne Lescot"
  },
  "machine": {
    "platform": "win32",
    "chip": "AMD Ryzen 5 7520U with Radeon Graphics",
    "gpu": "AMD Radeon(TM) Graphics",
    "cpuCount": 8,
    "memoryGiB": 15.3,
    "osVersion": "10.0.26200",
    "osBuild": "26200"
  },
  "conditions": {
    "onACPower": true,
    "maxForeignCpuPercent": 162,
    "loadSpreadPercentagePoints": 71,
    "driftRatio": 1.0266,
    "floorSpreadPercent": 6.02,
    "remoteDesktopActive": false
  },
  "scenario": {
    "step": "S4",
    "outputWidth": 1920,
    "outputHeight": 1080,
    "outputFps": 60,
    "outputCodec": "h264"
  },
  "source": {
    "kind": "public-bundle",
    "bundle": "commons-upload",
    "downloadSha256": "f8f1cd1fab93e739c6a071e5664619299f9f012d352f0055c1b52957d8004dc4",
    "normalisedSha256": "ef5cc06cc6299da594c9b0f95a64bfef083b17152a5466264d7364c205d4fb4a",
    "durationSec": 60,
    "frames": 3600
  },
  "measurements": [
    {
      "tool": "focusee",
      "version": "2.3.5",
      "exportMs": 207791,
      "madMs": 3287,
      "runs": 3,
      "localFloorMs": 19369,
      "softwareFloorMs": 41099,
      "floorSpreadPercent": 2.36,
      "cpuSeconds": 467.23,
      "peakRssMiB": 3339.9,
      "foreignCpuPercent": 162,
      "outputBytes": 101773644,
      "outputMeanVolumeDb": -49.8,
      "fidelity": 1,
      "missing": [],
      "contradicted": [],
      "verified": true,
      "automation": "uia"
    },
    {
      "tool": "openscreen",
      "version": "1.10.0",
      "exportMs": 34524,
      "madMs": 743,
      "runs": 3,
      "localFloorMs": 19240,
      "softwareFloorMs": 42306,
      "floorSpreadPercent": 6.02,
      "cpuSeconds": 11.08,
      "peakRssMiB": 966.4,
      "foreignCpuPercent": 91,
      "outputBytes": 56884485,
      "outputMeanVolumeDb": -49.8,
      "fidelity": 1,
      "missing": [],
      "contradicted": [],
      "verified": true,
      "automation": "cli"
    }
  ],
  "notes": [
    "focusee: timeline: / 01:00.00, zooms 1.6x 2.2x 1.8x",
    "focusee: telemetry: 3600 moves, 16 clicks",
    "focusee: padding=5/25, roundness=20/20 (FocuSee's own slider units — the scenario's 40px has no conversion into that range and is clamped), shadow=0.2",
    "focusee: the app took every channel the project declares",
    "openscreen: MP4 export is fixed at 60 fps (MP4_EXPORT_FPS, src/cli/CliExportRunner.tsx) — which is why the pinned target is 60.",
    "focusee: this row disagrees with the 5800X rows by a factor of nine on the same build — 10.73x here against 1.15x there, both full fidelity and verified. The machines differ in GPU, not in what was measured: an RTX 4070 Ti there, integrated Radeon graphics here. OpenScreen is 3.5x slower on this machine, which is the CPU gap; FocuSee is 24x slower, which is not. Its 467 CPU-seconds for a 208s export, over two cores held continuously, look like compositing falling back off the GPU. Published as disagreement rather than averaged, per the protocol.",
    "conditions: measured with the desktop session in use — the Claude app and a browser held ~45% of one core throughout, on four physical cores. That is the 71-point load gap between the legs, and the reason this row is weighted x0.132. The floors themselves were steady (2.36% and 6.02% spread, drift 1.027)."
  ]
}
