{
  "schemaVersion": 1,
  "submittedAt": "2026-09-16T11:22:16.115Z",
  "submitter": {
    "name": "Etienne Lescot"
  },
  "machine": {
    "platform": "linux",
    "chip": "AMD Ryzen 5 7520U with Radeon Graphics",
    "gpu": "Advanced Micro Devices, Inc. [AMD/ATI] Mendocino (rev c1)",
    "cpuCount": 8,
    "memoryGiB": 14.9,
    "osVersion": "24.04",
    "osBuild": ""
  },
  "conditions": {
    "onACPower": true,
    "maxForeignCpuPercent": 114.5,
    "loadSpreadPercentagePoints": 0,
    "driftRatio": 1.377,
    "floorSpreadPercent": 1.41,
    "remoteDesktopActive": false
  },
  "scenario": {
    "step": "S4",
    "outputWidth": 1920,
    "outputHeight": 1080,
    "outputFps": 60,
    "outputCodec": "h264"
  },
  "source": {
    "kind": "public-bundle",
    "bundle": "commons-upload",
    "downloadSha256": "f8f1cd1fab93e739c6a071e5664619299f9f012d352f0055c1b52957d8004dc4",
    "normalisedSha256": "502588cae0a8507c03ee964006be140543206f3c774ef06dcbf9fdc5f369d9f1",
    "durationSec": 60.007,
    "frames": 3600
  },
  "measurements": [
    {
      "tool": "cap",
      "version": "0.6.0",
      "exportMs": 54708,
      "madMs": 260,
      "runs": 3,
      "localFloorMs": 19123,
      "softwareFloorMs": 38653,
      "floorSpreadPercent": 1.41,
      "cpuSeconds": 171,
      "peakRssMiB": 703.8,
      "foreignCpuPercent": 82.6,
      "outputBytes": 188420825,
      "outputMeanVolumeDb": -49.8,
      "fidelity": 1,
      "missing": [],
      "contradicted": [],
      "verified": true,
      "automation": "cli"
    }
  ],
  "notes": [
    "cap: zoom segments written: 3",
    "cap: camera track: content/camera.mp4; cursor telemetry: content/cursor.json; audio: content/system-audio.m4a"
  ]
}
