{
  "schemaVersion": 1,
  "submittedAt": "2026-08-26T14:29:56.614Z",
  "submitter": {
    "name": "Etienne Lescot"
  },
  "machine": {
    "platform": "win32",
    "chip": "AMD Ryzen 7 5800X 8-Core Processor             ",
    "gpu": "NVIDIA GeForce RTX 4070 Ti",
    "cpuCount": 16,
    "memoryGiB": 31.9,
    "osVersion": "10.0.26200",
    "osBuild": "26200"
  },
  "conditions": {
    "onACPower": true,
    "maxForeignCpuPercent": 96,
    "loadSpreadPercentagePoints": 14.5,
    "driftRatio": 0.9997,
    "remoteDesktopActive": false
  },
  "scenario": {
    "step": "S4",
    "outputWidth": 1920,
    "outputHeight": 1080,
    "outputFps": 60,
    "outputCodec": "h264"
  },
  "source": {
    "kind": "public-bundle",
    "bundle": "commons-upload",
    "downloadSha256": "f8f1cd1fab93e739c6a071e5664619299f9f012d352f0055c1b52957d8004dc4",
    "normalisedSha256": "9162881a929643de62a4a97dee57571d514878d727585da60709bf4dfefd0d53",
    "durationSec": 60.007,
    "frames": 3600
  },
  "measurements": [
    {
      "tool": "openscreen-cli",
      "version": "1.10.0.0",
      "exportMs": 9845,
      "madMs": null,
      "runs": 5,
      "localFloorMs": 9143,
      "cpuSeconds": 4.73,
      "peakRssMiB": 798.7,
      "foreignCpuPercent": 76.5,
      "outputBytes": 36693461,
      "outputMeanVolumeDb": null,
      "fidelity": 1,
      "missing": [],
      "contradicted": [],
      "verified": true,
      "automation": "cli"
    },
    {
      "tool": "cap",
      "version": "0.5.9",
      "exportMs": 23219,
      "madMs": null,
      "runs": 5,
      "localFloorMs": 9173,
      "cpuSeconds": 43.83,
      "peakRssMiB": 1380.3,
      "foreignCpuPercent": 62,
      "outputBytes": 151113212,
      "outputMeanVolumeDb": null,
      "fidelity": 1,
      "missing": [],
      "contradicted": [],
      "verified": true,
      "automation": "cli"
    }
  ],
  "notes": []
}
