{
	"schemaVersion": 1,
	"submittedAt": "2026-10-03T19:43:58.185Z",
	"submitter": {
		"name": "Etienne Lescot"
	},
	"machine": {
		"platform": "darwin",
		"chip": "Apple M1",
		"gpu": "Apple M1",
		"cpuCount": 8,
		"memoryGiB": 8,
		"osVersion": "26.5",
		"osBuild": "25F71"
	},
	"conditions": {
		"onACPower": true,
		"maxForeignCpuPercent": 54.2,
		"loadSpreadPercentagePoints": 42.3,
		"driftRatio": 0.9999,
		"floorSpreadPercent": 0.09,
		"remoteDesktopActive": false
	},
	"scenario": {
		"step": "S4",
		"outputWidth": 1920,
		"outputHeight": 1080,
		"outputFps": 60,
		"outputCodec": "h264"
	},
	"source": {
		"kind": "public-bundle",
		"bundle": "commons-upload",
		"downloadSha256": "f8f1cd1fab93e739c6a071e5664619299f9f012d352f0055c1b52957d8004dc4",
		"normalisedSha256": "c407c71ad0de9c89533abe2d66918657f76f4e9474d86241efc8e03e5d779c66",
		"durationSec": 60,
		"frames": 3600
	},
	"measurements": [
		{
			"tool": "openscreen",
			"version": "2.0.0",
			"exportMs": 19414,
			"madMs": 5,
			"runs": 3,
			"localFloorMs": 18223,
			"softwareFloorMs": null,
			"floorSpreadPercent": 0.04,
			"cpuSeconds": 27.07,
			"peakRssMiB": 809,
			"foreignCpuPercent": 11.8,
			"outputBytes": 125563024,
			"outputMeanVolumeDb": -37.8,
			"fidelity": 1,
			"missing": [],
			"contradicted": [],
			"verified": true,
			"automation": "cli"
		},
		{
			"tool": "screen-studio",
			"version": "4.0.1-4897",
			"exportMs": 37452,
			"madMs": 59,
			"runs": 3,
			"localFloorMs": 18311,
			"softwareFloorMs": null,
			"floorSpreadPercent": 0.09,
			"cpuSeconds": 56.78,
			"peakRssMiB": 1074.8,
			"foreignCpuPercent": 54.1,
			"outputBytes": 102220953,
			"outputMeanVolumeDb": -46.8,
			"fidelity": 1,
			"missing": [],
			"contradicted": [],
			"verified": true,
			"automation": "cdp+menu"
		}
	],
	"notes": [
		"openscreen: MP4 export is fixed at 60 fps (MP4_EXPORT_FPS, src/cli/CliExportRunner.tsx) — which is why the pinned target is 60.",
		"screen-studio: app read back: padding 5.72, radius 40, shadow 0.2, motion blur 0.5, cursor 1.5× (2006 moves, 16 clicks), camera 0.25 bottom-right, 3 zoom ranges, audio true",
		"screen-studio: cursor size is written as 150% → 1.5; the app's Cursor panel displays twice that, and its own default for an imported project is 1.5",
		"screen-studio: cursor smoothing is a spring here, not a scalar: 0.7 enables it and the app's own spring constants are left alone",
		"ffmpeg-baseline: encoder: h264_videotoolbox (hardware)",
		"ffmpeg-baseline: No compositing: this row is the encode-only reference, not a product.",
		"run 20261003T184226Z also measured cap 0.6.0 and recordly 1.4.0; neither is submitted from it. Cap ran under 137% foreign load (macOS ANECompilerService), against 12-54% for the two rows here. Recordly 1.4.0 exported, but the project it saved back carries cursor size 2.5, cursor smoothing 0.67 and webcam size 10 where 1.5, 0.7 and 0.25 were written, so the scene it rendered is not the pinned one."
	]
}
